question,answer
"What role does sodium play in nerve impulse transmission, and how does it contribute to muscle contraction?","Sodium is crucial for nerve impulse transmission as it creates a charge difference between the nerve cell and its extracellular environment by moving into the nerve cell. This sodium current along the nerve cell is similar to how an electric current moves along a wire. Additionally, sodium is involved in muscle contraction by facilitating the movement of ions necessary for muscle stimulation."
"How can endurance athletes avoid hyponatremia during prolonged physical activity, and why is drinking too much water potentially harmful?","Endurance athletes can avoid hyponatremia by drinking the correct amount of water, approximately one cup every twenty minutes during the event, and consuming foods that provide necessary electrolytes. Drinking too much water can dilute the sodium concentration in the blood, leading to hyponatremia, which can cause symptoms like nausea, muscle cramps, confusion, dizziness, and in severe cases, coma or death."
"What are the dietary recommendations for sodium intake according to the Institute of Medicine (IOM) and the American Heart Association (AHA), and what are the risks associated with excessive sodium consumption?","The Institute of Medicine (IOM) recommends an adequate intake (AI) of 1,500 milligrams of sodium per day for healthy adults, with a tolerable upper intake level (UL) of 2,300 milligrams. The American Heart Association (AHA) suggests consuming less than 1,500 milligrams of sodium per day to prevent cardiovascular disease. Excessive sodium consumption is associated with an increased risk of hypertension, which can lead to cardiovascular disease."
"How is the water secreted by the salivary glands, gastric juice, and pancreatic juice during digestion replaced in these organs? What happens to the water now in the intestines?","The water secreted by the salivary glands, gastric juice, and pancreatic juice is replaced through a complex process involving the osmoregulation system, which includes communication between the brain, kidneys, and endocrine system. The water in the intestines is absorbed and recycled back into the body, contributing to the exchange of approximately 10 liters of water among the body’s organs daily."
"What is the average daily water output and input, and how is this balance achieved?","The average daily water output is 2.5 liters, which must be balanced with water input. The body produces around 300 milliliters of water daily through metabolic processes, and the remainder must be balanced by drinking fluids (about 1.5 liters) and consuming solid foods (approximately 700 milliliters). This balance is necessary to maintain proper hydration and bodily functions."
"What are the dietary recommendations for water intake, and how do they vary between males and females?","The Institute of Medicine (IOM) recommends an Adequate Intake (AI) of water for adult males at 3.7 liters (15.6 cups) and for adult females at 2.7 liters (11 cups) per day. These recommendations include water from all dietary sources, including food and beverages. It is important to note that actual water needs can vary based on factors such as climate, age, physical activity level, and kidney function."
"How do proteins contribute to the structure and texture of foods?","Proteins provide food with structure and texture by enabling water retention and foaming when agitated. For example, whisking egg whites creates foam bubbles that give angel food cake its airy texture, and milk proteins called caseins coagulate to increase yogurt's thickness. Cooked proteins also add color and flavor to foods by binding with carbohydrates, producing a brown pigment and aroma."
"What happens to proteins during the denaturation process, and what causes it?","During denaturation, proteins are exposed to abnormal conditions such as heat, acid, high salt concentrations, alcohol, or mechanical agitation, causing their folded structures to unravel into long strands of amino acids. This process breaks the weak chemical forces holding the protein’s structure, rendering the proteins non-functional as their shape is crucial to their function."
"How does heat affect proteins during cooking, and what is the result of this process?","Heat causes proteins to vibrate, breaking the weak bonds that maintain their complex shape. This leads to the denaturation of proteins, where the unfolded protein strands stick together to form an aggregate or network. This aggregation gives structure to foods like cakes during baking."
"How long does it take for a legally intoxicated person to achieve sobriety after drinking stops?","It takes at least five hours for a legally intoxicated person (with a BAC of 0.08) to achieve sobriety, considering the rate at which the liver metabolizes alcohol and the alcohol excretion rate."
"What percentage of ethanol is metabolized by the liver, and what are the two metabolic processes involved?","The liver metabolizes up to 85%–98% of the circulatory ethanol using two metabolic processes: the Alcohol Dehydrogenase System (which processes about 80%–90% of the total hepatic ethanol uptake) and the Microsomal Ethanol Oxidizing System (MEOS), which processes about 10%–20% of the total liver ethanol uptake, especially during periods of heavy drinking."
"What is the role of acetaldehyde dehydrogenase (ALDH) in alcohol metabolism?","Acetaldehyde dehydrogenase (ALDH) converts acetaldehyde, a toxic byproduct of alcohol metabolism, into acetate, a non-toxic molecule. This process is crucial to protect liver cells and the body’s cells from the harmful effects of acetaldehyde."
"What are the primary functions of vitamin A in the human body, and what are the consequences of its deficiency?","Vitamin A is essential for vision, immune function, and cell growth. Its deficiency can lead to night blindness, xerophthalmia (dry eyes), and an increased susceptibility to infections."
"How does vitamin D contribute to bone health, and what are the health implications of its deficiency?","Vitamin D aids in calcium absorption, which is crucial for maintaining bone density and strength. Deficiency can result in rickets in children, osteomalacia in adults, and an increased risk of fractures."
"What are the recommended dietary sources of vitamin A and vitamin D?","Vitamin A can be obtained from liver, fish oils, and colorful vegetables such as carrots. Vitamin D sources include fatty fish (like salmon), fortified dairy products, and exposure to sunlight."
